{
  "$schema": "http://json-schema.org/draft-07/schema#",
  "title": "FCNN Configuration",
  "type": "object",
  "properties": {
    "dataset_name": {
      "type": "string",
      "enum": [
        "adult",
        "cifar10",
        "connect4",
        "isolete",
        "letter",
        "mnist",
        "mnist_fashion",
        "musk2",
        "optdigits",
        "page_blocks",
        "satimages",
        "segment",
        "shuttle",
        "spambase",
        "usps",
        "wall",
        "waveform"
      ],
      "description": "The name of the dataset to be used."
    },
    "patience": {
      "type": "integer",
      "description": "The number of epochs after which the training should be stopped if the validation loss is not decreasing."
    },
    "seed": {
      "type": "boolean",
      "description": "Controls the way to generate random values. If set to True, the same values will be generated in every execution."
    },
    "optimizer": {
      "type": "string",
      "enum": ["adam", "sgd"],
      "description": "Desired optimizer to use."
    },
    "optimization": {
      "type": "object",
      "description": "Optimization configurations for different datasets.",
      "properties": {
        "adam": {
          "type": "object",
          "description": "Configuration for ADAM optimizer for different datasets.",
          "properties": {
            "learning_rate": {
              "type": "object",
              "description": "Learning rates for different datasets using ADAM.",
              "properties": {
                "adult": { "type": "number" },
                "cifar10": { "type": "number" },
                "connect4": { "type": "number" },
                "isolete": { "type": "number" },
                "letter": { "type": "number" },
                "mnist": { "type": "number" },
                "mnist_fashion": { "type": "number" },
                "musk2": { "type": "number" },
                "optdigits": { "type": "number" },
                "page_blocks": { "type": "number" },
                "satimages": { "type": "number" },
                "segment": { "type": "number" },
                "shuttle": { "type": "number" },
                "spambase": { "type": "number" },
                "usps": { "type": "number" },
                "wall": { "type": "number" },
                "waveform": { "type": "number" }
              },
              "additionalProperties": false
            }
          },
          "additionalProperties": false
        },
        "sgd": {
          "type": "object",
          "description": "Configuration for SGD optimizer for different datasets.",
          "properties": {
            "learning_rate": {
              "type": "object",
              "description": "Learning rates for different datasets using SGD.",
              "properties": {
                "adult": { "type": "number" },
                "cifar10": { "type": "number" },
                "connect4": { "type": "number" },
                "isolete": { "type": "number" },
                "letter": { "type": "number" },
                "mnist": { "type": "number" },
                "mnist_fashion": { "type": "number" },
                "musk2": { "type": "number" },
                "optdigits": { "type": "number" },
                "page_blocks": { "type": "number" },
                "satimages": { "type": "number" },
                "segment": { "type": "number" },
                "shuttle": { "type": "number" },
                "spambase": { "type": "number" },
                "usps": { "type": "number" },
                "wall": { "type": "number" },
                "waveform": { "type": "number" }
              },
              "additionalProperties": false
            },
            "momentum": {
              "type": "object",
              "description": "Momentum values for different datasets using SGD.",
              "properties": {
                "adult": { "type": "number" },
                "cifar10": { "type": "number" },
                "connect4": { "type": "number" },
                "isolete": { "type": "number" },
                "letter": { "type": "number" },
                "mnist": { "type": "number" },
                "mnist_fashion": { "type": "number" },
                "musk2": { "type": "number" },
                "optdigits": { "type": "number" },
                "page_blocks": { "type": "number" },
                "satimages": { "type": "number" },
                "segment": { "type": "number" },
                "shuttle": { "type": "number" },
                "spambase": { "type": "number" },
                "usps": { "type": "number" },
                "wall": { "type": "number" },
                "waveform": { "type": "number" }
              },
              "additionalProperties": false
            }
          },
          "additionalProperties": false
        }
      },
      "additionalProperties": false
    },
    "hidden_neurons": {
      "type": "object",
      "description": "Number of hidden nodes in the hidden layers for different datasets.",
      "properties": {
        "adult": {
          "type": "integer"
        },
        "cifar10": {
          "type": "integer"
        },
        "connect4": {
          "type": "integer"
        },
        "isolete": {
          "type": "integer"
        },
        "letter": {
          "type": "integer"
        },
        "mnist": {
          "type": "integer"
        },
        "mnist_fashion": {
          "type": "integer"
        },
        "musk2": {
          "type": "integer"
        },
        "optdigits": {
          "type": "integer"
        },
        "page_blocks": {
          "type": "integer"
        },
        "satimages": {
          "type": "integer"
        },
        "segment": {
          "type": "integer"
        },
        "shuttle": {
          "type": "integer"
        },
        "spambase": {
          "type": "integer"
        },
        "usps": {
          "type": "integer"
        },
        "wall": {
          "type": "integer"
        },
        "waveform": {
          "type": "integer"
        }
      }
    },
    "batch_size": {
      "type": "object",
      "description": "Batch sizes for different datasets.",
      "properties": {
        "adult": {
          "type": "integer"
        },
        "cifar10": {
          "type": "integer"
        },
        "connect4": {
          "type": "integer"
        },
        "isolete": {
          "type": "integer"
        },
        "letter": {
          "type": "integer"
        },
        "mnist": {
          "type": "integer"
        },
        "mnist_fashion": {
          "type": "integer"
        },
        "musk2": {
          "type": "integer"
        },
        "optdigits": {
          "type": "integer"
        },
        "page_blocks": {
          "type": "integer"
        },
        "satimages": {
          "type": "integer"
        },
        "segment": {
          "type": "integer"
        },
        "shuttle": {
          "type": "integer"
        },
        "spambase": {
          "type": "integer"
        },
        "usps": {
          "type": "integer"
        },
        "wall": {
          "type": "integer"
        },
        "waveform": {
          "type": "integer"
        }
      }
    },
    "epochs": {
      "type": "integer",
      "description": "Number of epochs."
    },
    "num_tests": {
      "type": "integer",
      "description": "How many times a test should be repeated."
    },
    "device": {
      "type": "string",
      "enum": ["gpu", "cuda", "cpu"],
      "description": "The selected device where the computations will be executed."
    }
  },
  "required": ["dataset_name", "patience", "seed", "hidden_neurons", "batch_size", "epochs"]
}